{
    "$schema": "http://json-schema.org/draft-04/schema#",
    "type": "object",
    "properties": {
        "minimumJavaVersion": {
            "type": "integer"
        },
        "prerequesites": {
            "type": "array",
            "items": {
                "type": "string"
            }
        },
        "clouds": {
            "type": "array",
            "items": {
                "type": "string"
            }
        },
        "skipGradleTests": {
            "type": "boolean"
        },
        "intro": {
            "type": "string"
        },
        "skipMavenTests": {
            "type": "boolean"
        },
        "features": {
            "type": "array",
            "items": {
                "type": "string"
            }
        },
        "publicationDate": {
            "type": "string"
        },
        "asciidoctor": {
            "type": "string"
        },
        "languages": {
            "type": "array",
            "items": {
                "type": "string"
            }
        },
        "tags": {
            "type": "array",
            "items": {
                "type": "string"
            }
        },
        "buildTools": {
            "type": "array",
            "items": {
                "type": "string"
            }
        },
        "testFramework": {
            "type": "string"
        },
        "zipIncludes": {
            "type": "array",
            "items": {
                "type": "string"
            }
        },
        "categories": {
            "type": "array",
            "items": {
                "type": "string"
            }
        },
        "slug": {
            "type": "string"
        },
        "publish": {
            "type": "boolean"
        },
        "title": {
            "type": "string"
        },
        "authors": {
            "type": "array",
            "items": {
                "type": "string"
            }
        },
        "maximumJavaVersion": {
            "type": "integer"
        },
        "base": {
            "type": "string"
        },
        "env": {
            "type": "object",
            "properties": {
                "AWS_SECRET_ACCESS_KEY": {
                    "type": "string"
                },
                "AWS_REGION": {
                    "type": "string"
                },
                "AWS_ACCESS_KEY_ID": {
                    "type": "string"
                }
            }
        },
        "apps": {
            "type": "array",
            "items": {
                "type": "object",
                "properties": {
                    "invisibleFeatures": {
                        "type": "array",
                        "items": {
                            "type": "string"
                        }
                    },
                    "kotlinFeatures": {
                        "type": "array",
                        "items": {
                            "type": "string"
                        }
                    },
                    "validateLicense": {
                        "type": "boolean"
                    },
                    "testFramework": {
                        "type": "string"
                    },
                    "javaFeatures": {
                        "type": "array",
                        "items": {
                            "type": "string"
                        }
                    },
                    "framework": {
                        "type": "string"
                    },
                    "name": {
                        "type": "string"
                    },
                    "features": {
                        "type": "array",
                        "items": {
                            "type": "string"
                        }
                    },
                    "packageName": {
                        "type": "string"
                    },
                    "excludeTest": {
                        "type": "array",
                        "items": {
                            "type": "string"
                        }
                    },
                    "applicationType": {
                        "type": "string"
                    }
                }
            }
        }
    }
}