{
  "asciidoctor": "micronaut-kotlin-extension-fns.adoc",
  "slug": "micronaut-kotlin-extension-fns",
  "title": "Using Kotlin Extension Functions in Micronaut",
  "intro": "Take a tour of the extension functions in Micronaut and learn to write your own",
  "authors": ["Will Buck"],
  "languages": ["kotlin"],
  "apps": [
    {
      "name": "default",
      "features": ["graalvm", "kotlin-extension-functions"]
    }
  ]
}
