{
  "title": "Micronaut Basic Auth",
  "intro": "Learn how to secure a Micronaut application using 'Basic' HTTP Authentication Scheme.",
  "features": ["security", "graalvm"],
  "authors": ["Sergio del Amo"],
  "tags": ["basic-auth", "security", "graal"],
  "categories": ["Micronaut Security"],
  "publicationDate": "2018-05-24",
  "languages": ["JAVA", "GROOVY", "KOTLIN", "PYTHON"],
  "apps": [
    {
      "name": "default",
      "features": ["security"],
      "javaFeatures": ["graalvm"],
      "kotlinFeatures": ["graalvm"]
    }
  ]
}
