{
  "asciidoctor": "micronaut-data-access-jpa-hibernate.adoc",
  "slug": "micronaut-data-access-jpa-hibernate",
  "title": "Access a database with JPA and Hibernate",
  "intro": "Learn how to access a database with JPA and Hibernate using Micronaut.",
  "authors": ["Sergio del Amo"],
  "languages": ["java"],
  "apps": [
    {
      "name": "default",
      "features": ["graalvm", "hibernate-jpa", "data-jpa"]
    }
  ]
}
